{
  "schema": 1,
  "family": "bounds/masked-index",
  "tags": ["bounds", "proof-1", "masked-index"],
  "hypothesis": "For a const array of power-of-two length N, a direct index temporary defined as iand<u64>(source, N - 1) is in bounds. Facts-on compilation may elide that index check. Changing any structural premise must conservatively retain the check, even when a broader prover could establish safety.",
  "measurement": {
    "function": "lookup",
    "metric": "proof.sites",
    "opt": "O2",
    "facts_on": "compile_program(source, alias=true)",
    "facts_off": "compile_program(source, alias=false)",
    "note": "Count traps only in lookup; main deliberately contains an independent result check."
  },
  "cases": [
    {
      "id": "p01-mask3-table4",
      "source": "p01-mask3-table4.wf",
      "hypothesis": "The minimal N=4 direct mask idiom is proven.",
      "tags": ["positive", "power-of-two", "mask-3", "baseline"],
      "maturity": "gate",
      "expected": {"proof_classification": "elided", "bounds_sites": 1, "facts_trap_calls": 0, "nofacts_trap_calls": 1, "trap_relation": "facts < nofacts"}
    },
    {
      "id": "p02-mask3-benign-doc",
      "source": "p02-mask3-benign-doc.wf",
      "hypothesis": "A doc statement between mask and access does not invalidate the proof.",
      "tags": ["positive", "power-of-two", "metamorphic", "benign-doc"],
      "maturity": "gate",
      "expected": {"proof_classification": "elided", "bounds_sites": 1, "facts_trap_calls": 0, "nofacts_trap_calls": 1, "trap_relation": "facts < nofacts"}
    },
    {
      "id": "p03-mask3-benign-independent-let",
      "source": "p03-mask3-benign-independent-let.wf",
      "hypothesis": "Independent wrapped arithmetic between mask and access does not invalidate the proof.",
      "tags": ["positive", "power-of-two", "metamorphic", "benign-let"],
      "maturity": "gate",
      "expected": {"proof_classification": "elided", "bounds_sites": 1, "facts_trap_calls": 0, "nofacts_trap_calls": 1, "trap_relation": "facts < nofacts"}
    },
    {
      "id": "p04-mask7-table8",
      "source": "p04-mask7-table8.wf",
      "hypothesis": "The direct idiom scales from N=4 to N=8.",
      "tags": ["positive", "power-of-two", "mask-7", "scale"],
      "maturity": "gate",
      "expected": {"proof_classification": "elided", "bounds_sites": 1, "facts_trap_calls": 0, "nofacts_trap_calls": 1, "trap_relation": "facts < nofacts"}
    },
    {
      "id": "p05-mask7-two-reads",
      "source": "p05-mask7-two-reads.wf",
      "hypothesis": "One valid mask temporary proves accesses to multiple same-sized const arrays.",
      "tags": ["positive", "power-of-two", "mask-7", "multiple-accesses", "metamorphic"],
      "maturity": "gate",
      "expected": {"proof_classification": "elided", "bounds_sites": 2, "facts_trap_calls": 0, "nofacts_trap_calls": 1, "trap_relation": "facts < nofacts"}
    },
    {
      "id": "p06-mask15-table16",
      "source": "p06-mask15-table16.wf",
      "hypothesis": "The direct idiom scales from N=8 to N=16.",
      "tags": ["positive", "power-of-two", "mask-15", "scale"],
      "maturity": "gate",
      "expected": {"proof_classification": "elided", "bounds_sites": 1, "facts_trap_calls": 0, "nofacts_trap_calls": 1, "trap_relation": "facts < nofacts"}
    },
    {
      "id": "n01-undersized-mask",
      "source": "n01-undersized-mask.wf",
      "hypothesis": "PROOF-1 v1 rejects a safe but non-canonical smaller mask because it is not exactly N - 1.",
      "tags": ["negative", "wrong-mask", "safe-near-miss", "conservative"],
      "maturity": "gate",
      "expected": {"proof_classification": "checked", "bounds_sites": 1, "facts_trap_calls": 1, "nofacts_trap_calls": 1, "trap_relation": "facts == nofacts"}
    },
    {
      "id": "n02-oversized-mask",
      "source": "n02-oversized-mask.wf",
      "hypothesis": "A mask larger than N - 1 can produce an out-of-bounds index and must remain checked.",
      "tags": ["negative", "wrong-mask", "unsafe-near-miss", "soundness"],
      "maturity": "gate",
      "expected": {"proof_classification": "checked", "bounds_sites": 1, "facts_trap_calls": 1, "nofacts_trap_calls": 1, "trap_relation": "facts == nofacts"}
    },
    {
      "id": "n03-mask5-table6",
      "source": "n03-mask5-table6.wf",
      "hypothesis": "A non-power-of-two table remains checked even when this particular bitmask happens to select only valid indices.",
      "tags": ["negative", "non-power-of-two", "safe-near-miss", "conservative"],
      "maturity": "gate",
      "expected": {"proof_classification": "checked", "bounds_sites": 1, "facts_trap_calls": 1, "nofacts_trap_calls": 1, "trap_relation": "facts == nofacts"}
    },
    {
      "id": "n04-offset-after-mask",
      "source": "n04-offset-after-mask.wf",
      "hypothesis": "Adding an offset after masking can produce N and must break the direct-mask proof.",
      "tags": ["negative", "offset", "unsafe-near-miss", "soundness"],
      "maturity": "gate",
      "expected": {"proof_classification": "checked", "bounds_sites": 1, "facts_trap_calls": 1, "nofacts_trap_calls": 1, "trap_relation": "facts == nofacts"}
    },
    {
      "id": "n05-mutated-mask-temporary",
      "source": "n05-mutated-mask-temporary.wf",
      "hypothesis": "Mutating the masked temporary before indexing invalidates its range fact.",
      "tags": ["negative", "mutation", "unsafe-near-miss", "soundness"],
      "maturity": "gate",
      "expected": {"proof_classification": "checked", "bounds_sites": 1, "facts_trap_calls": 1, "nofacts_trap_calls": 1, "trap_relation": "facts == nofacts"}
    },
    {
      "id": "n06-copied-mask-temporary",
      "source": "n06-copied-mask-temporary.wf",
      "hypothesis": "PROOF-1 v1 does not propagate a range fact through a copy temporary.",
      "tags": ["negative", "copy", "safe-near-miss", "conservative"],
      "maturity": "gate",
      "expected": {"proof_classification": "checked", "bounds_sites": 1, "facts_trap_calls": 1, "nofacts_trap_calls": 1, "trap_relation": "facts == nofacts"}
    }
  ]
}
